url,title,description,keywords,contact_info,summary
http://4victorias.setmore.com,Booking Page Not Found | Setmore,Check the URL and try again.,,00000000,
http://az-property-plus.com/,,,,00000000,
http://cholesterolhht.abrightsmile.website,abrightsmile.website,,,00000000,
http://davisproductsco.com/,Janitorial Supplies & Equipment | Davis Products,Davis Products stocks about 1500 building maintenance items including full line janitorial supplies|| paper & disposables|| equipment|| & fire & safety products.,,(985) 892-5013,"Janitorial Supplies  Equipment  Davis Products. Davis Products Company stocks more than 1500 building maintenance items including a full line janitorial supplies, paper and disposables, equipment, and fire and safety products."
http://digitizerzone.com,All GTCO/CalComp Digitizers - FREE SHIPPING,Providing GTCO Calcomp digitizers and graphics tablets|| parts and accessories.,gtco|| gtco digitizers|| gtco board|| digitizer board|| digitizing|| graphics tablet|| 3d digitizer|| accutab|| accutab board|| accutab vi|| accutab 6|| drawingboard|| calcomp drawingboard|| drawingboard 6|| drawingboard VI|| drawing board|| 34180|| summa graphics|| cadpro|| super l|| gtco super l|| super l vi|| super l 6|| freepoint|| gp9|| digitizer stand|| quikruler 3|| quik ruler|| quikruler|| quickruler|| quick ruler|| summagrid|| summasketch|| digitizer base|| gtco rollup|| rollup|| roll up|| roll up digitizer,00000000,All GTCOCalComp Digitizers  FREE SHIPPING.
http://eatatruperts.com/,Rupert's Restaurants,,,00000000,"Scratch cooking, premium ingredients, stellar service, friendly atmosphere and comfortable environment come together to create a popular destination to gather for breakfast, brunch and lunch. We opened our Sloanâs Lake location in Edgewater, Denver in 2014 and are excited to be opening a second location in Durango, CO in Summer 2022."
http://eliaslandscapingservices.com,Prominent Landscaping Contractor in Aurora|| CO 80013,Elias Landscaping Services LLC is a professional landscaping contractor in Aurora|| CO|| 80013 that can assist you with your needs!,,Phone: (720) 237-9920,"I specialize in landscaping, meaning I can convert open spaces into elegant and colorful gardens that contribute to the appeal of residential and commercial properties. Instead of spending hours collecting and removing fallen leaves, spend your time with your family while I handle your front and back yards cleaning."
http://freeshed.design,Shed Builders can Choose from 12K Shed Plans and Woodworking Pattern,Some of the plans include a Garden bench|| How to Build a Fence|| Dog Kennel|| Making an Easy Arbor|| Swing Pet|| Nursery and a lot more.,,00000000,Shed Builders can Choose from 12K Shed Plans and Woodworking Pattern. Free Shed Plans Design the writer of the book has given detailed blueprints and step by step instructions that even a beginner can follow.
http://heartburnhomeremedies.net,Heartburn Home Remedies – Do Natural Heartburn Treatments,,,00000000,"â Aside from the bad foods listed above, nearly all fruits and vegetables help reduce stomach acid. â Many nuts and seeds provide fiber and nutrients and may help absorb stomach acid."
http://hulahoopheads.com,"Hula Hoop Heads - One Stop Hula Hoop Shop
 – hulahoopheads","A large selection of Smart Hoops|| LED Hoops|| and Beginner Hoops. We have hula hoops for all ages and all skill levels. We offer every size hula hoop and a large variety of different materials including polypro|| HDPE|| and PE in 5/8""|| 3/4"" and 7/8"". Our hoops are handmade|| custom and made to order with LOVE!",,00000000,Hula Hoop Heads  One Stop Hula Hoop Shop  hulahoopheads. Choosing a selection results in a full page refresh
http://jesewing.com/,HOME | JE Sewing,Sewing contractor services|| automated pattern sewing,,00000000,"Use tab to navigate through the menu items. If you need complete turn key product, or just a single sewing operation, we are happy to partner with you."
http://kungpaobistro.com,Home | Kung Pao Bistro - West Hollywood,,,00000000,"We will be open 430pm  1000pm on July 4th, 2022 to observe Independence Day. Please place your DELIVERY orders on our website and they will be delivered through our thirdparty partner."
http://ldtowingcollisionllc.com/,L&D Towing & Collision - Auto Body Shop in Memphis,,,00000000,Tire fell off a 18 wheeler and hit My Mercedes.Front bumper and hood was replaced threw my insurance. Chris fixed my existing bumper in 2 days and returned my car to me.
http://mscoffee.co/,Main Street Coffee Co,,,00000000,Main Street Coffee Co. Nested in the heart of Poplarville. Main Street Coffee Co has a passion for serving our community the freshest coffee in town Our coffee has been carefully selected and roasted by a local roaster in New Orleans.
http://woodworkingusa.co,DIY Woodworking Plans,,adirondack woodworking plans|| advanced woodworking plans|| american woodworking plans|| antique woodworking plans|| baby crib woodworking plans|| bar woodworking plans|| bed woodworking plans|| beginner woodworking plans|| beginners woodworking plans|| beginning woodworking plans|| bench woodworking plans|| best woodworking plans|| birdhouse woodworking plans|| bookcase woodworking plans|| bookshelf woodworking plans|| buffet woodworking plans|| buy woodworking plans|| cabinet woodworking plans|| cad woodworking plans|| cedar woodworking plans|| chair woodworking plans|| chaise lounge woodworking plans|| chest woodworking plans|| children's woodworking plans|| coffee table woodworking plans|| contemporary woodworking plans|| cool woodworking plans|| country woodworking plans|| cradle woodworking plans|| crib woodworking plans|| cupboard woodworking plans|| curio cabinet woodworking plans|| custom woodworking plans|| desk woodworking plans|| diy woodworking plans|| do it yourself woodworking plans|| dollhouse woodworking plans|| door woodworking plans|| download woodworking plans|| downloadable woodworking plans|| draw woodworking plans|| dresser woodworking plans|| easel woodworking plans|| easy woodworking plans|| free woodwork plans|| free woodworking plan|| free woodworking plans|| futon woodworking plans|| glider rocker woodworking plans|| holiday woodworking plans|| humidor woodworking plans|| hutch woodworking plans|| japanese woodworking plans|| kids woodworking plans|| lamp woodworking plans|| lectern woodworking plans|| lighthouse woodworking plans|| mailbox woodworking plans|| master woodworking plans|| mirror woodworking plans|| modern woodworking plans|| nutcracker woodworking plans|| outdoor woodworking plans|| picnic table woodworking plans|| plans for woodworking|| plans woodwork|| podium woodworking plans|| printable woodworking plans|| rocking chair woodworking plans|| rocking horse woodworking plans|| rustic woodworking plans|| shaker woodworking plans|| shelf woodworking plans|| shutter woodworking plans|| sideboard woodworking plans|| simple woodworking plans|| small woodworking plans|| stool woodworking plans|| toy woodworking plans|| toybox woodworking plans|| unique woodworking plans|| valet woodworking plans|| vintage woodworking plans|| windmill woodworking plans|| woodsmith woodworking plans|| woodwork plan|| woodworker plan|| woodworker plans|| woodworkers plan|| woodworkers plans|| woodworking building plans|| woodworking craft plans|| woodworking design plans|| woodworking furniture plans|| woodworking plan|| woodworking plans|| woodworking plans baby|| woodworking plans benches|| woodworking plans book|| woodworking plans boxes|| woodworking plans cabinets|| woodworking plans catalog|| woodworking plans cd|| woodworking plans children|| woodworking plans clocks|| woodworking plans dog|| woodworking plans dvd|| woodworking plans for kids|| woodworking plans games|| woodworking plans garden|| woodworking plans glider|| woodworking plans golf|| woodworking plans guitar|| woodworking plans kitchen|| woodworking plans magazine|| woodworking plans mail|| woodworking plans online|| woodworking plans patterns|| woodworking plans pdf|| woodworking plans plans|| woodworking plans planter|| woodworking plans projects|| woodworking plans router|| woodworking plans shelves|| woodworking plans sofa|| woodworking plans software|| woodworking plans storage|| woodworking plans table|| woodworking plans tables|| woodworking plans toys|| woodworking plans trash|| woodworking plans tv|| woodworking plans tv stand|| woodworking plans wishing well|| woodworking plans workbench|| woodworking project plans|| woodworking shop plans|| woodworking tool plans|| woodworking work bench plans|| workshop woodworking plans|| advanced woodworking projects|| beginner woodwork projects|| beginner woodworking project|| beginner woodworking projects|| beginners woodworking projects|| beginning woodworking projects|| best woodworking projects|| cedar woodworking projects|| cheap woodworking projects|| children woodworking projects|| children's woodworking projects|| childrens woodworking projects|| cool woodworking projects|| custom woodworking projects|| diy woodwork projects|| diy woodworking projects|| do it yourself woodworking projects|| easy woodwork projects|| easy woodworking project|| easy woodworking project plans|| easy woodworking projects|| fine woodworking project|| fine woodworking projects|| first woodworking project|| free easy woodworking projects|| free online woodworking projects|| free plans for woodworking projects|| free simple woodworking projects|| free small woodworking projects|| free woodwork project|| free woodwork projects|| free woodworking project|| free woodworking project plans|| free woodworking projects|| free woodworking projects and|| free woodworking projects and plans|| free woodworking projects for beginners|| fun woodworking projects|| furniture woodworking projects|| garden woodworking projects|| good woodworking projects|| great woodworking projects|| high school woodworking project|| holiday woodworking projects|| home woodworking projects|| how to woodworking projects|| intermediate woodworking projects|| japanese woodworking projects|| kid woodworking projects|| kid's woodworking projects|| kids woodworking project|| kids woodworking project kits|| kids woodworking projects|| kids woodworking projects free|| lathe woodworking projects|| lees woodworking projects|| middle school woodworking projects|| modern woodworking projects|| money making woodworking projects|| my woodworking projects|| online woodworking projects|| outdoor woodworking projects|| plans for woodworking projects|| popular woodworking projects|| profitable woodworking projects|| projects for woodworkers|| projects for woodworking|| quick and easy woodworking projects|| quick woodworking projects|| rustic woodworking projects|| school woodworking project|| school woodworking projects|| scout woodworking projects|| selling woodworking projects|| simple woodwork projects|| simple woodworking project|| simple woodworking projects|| simple woodworking projects for kids|| simple woodworking projects kids|| small easy woodworking projects|| small woodwork projects|| small woodworking project|| small woodworking project plans|| small woodworking projects|| small woodworking projects for kids|| small woodworking projects free plans|| step by step woodworking projects|| student woodworking projects|| unique woodworking projects|| vintage woodworking projects|| weekend woodworking projects|| wood for woodworking projects|| woodwork project|| woodwork project plans|| woodwork projects|| woodworker project|| woodworker projects|| woodworkers project|| woodworkers projects|| woodworking clock projects|| woodworking craft projects|| woodworking gift projects|| woodworking project|| woodworking project book|| woodworking project books|| woodworking project design|| woodworking project for kids|| woodworking project ideas|| woodworking project kits|| woodworking project patterns|| woodworking project plan|| woodworking project software|| woodworking projects|| woodworking projects and plans|| woodworking projects bed|| woodworking projects bench|| woodworking projects book|| woodworking projects desk|| woodworking projects for beginners|| woodworking projects for boys|| woodworking projects for children|| woodworking projects for everyone|| woodworking projects for free|| woodworking projects for kids|| woodworking projects for teens|| woodworking projects for the home|| woodworking projects for women|| woodworking projects free plans|| woodworking projects from|| woodworking projects gifts|| woodworking projects ideas|| woodworking projects plans|| woodworking projects table|| woodworking projects to make|| woodworking projects to sell|| woodworking router projects|| woodworking shop projects|| woodworking toy projects|| your woodworking projects|| 2 x 4 furniture plans|| 2x4 furniture plans|| 4 furniture plans|| american furniture plans|| and furniture plans|| anne furniture plans|| aquarium furniture plans|| armoire furniture plans|| asian furniture plans|| baby furniture plans|| barbie furniture plans|| barrel furniture plans|| beginner furniture plans|| build furniture plans|| build it yourself furniture plans|| build your own furniture plans|| building furniture plans|| cabinet furniture plans|| camp furniture plans|| campaign furniture plans|| child furniture plans|| children furniture plans|| children's furniture plans|| cnc furniture plans|| colonial furniture plans|| country furniture plans|| crib furniture plans|| desk furniture plans|| diy furniture plans|| diy outdoor furniture plans|| do it yourself furniture plans|| dog furniture plans|| doll house furniture plans|| dollhouse furniture plans|| door furniture plans|| down furniture plans|| downloadable furniture plans|| draw furniture plans|| drawing furniture plans|| dresser furniture plans|| easy furniture plans|| federal furniture plans|| free furniture plans|| free outdoor furniture plans|| free woodworking furniture plans|| furniture business plans|| furniture designs plans|| furniture dolly plans|| furniture layaway plans|| furniture making plans|| furniture payment plans|| furniture plans|| furniture plans book|| furniture plans coffee table|| furniture plans corner|| furniture plans for a|| furniture plans in|| furniture plans online|| furniture plans pdf|| furniture plans software|| furniture plans to|| furniture plans with|| furniture project plans|| furniture protection plans|| furniture with payment plans|| furniture woodworking plans|| garden furniture plans|| green and green furniture plans|| home furniture plans|| house furniture plans|| hutch furniture plans|| indoor furniture plans|| it yourself furniture plans|| japanese furniture plans|| kids furniture plans|| log furniture plans|| lounge furniture plans|| medieval furniture plans|| mexican furniture plans|| outdoor furniture building plans|| outdoor furniture plans|| outdoor furniture woodworking plans|| outside furniture plans|| pallet furniture plans|| payment plans for furniture|| period furniture plans|| pipe furniture plans|| plans for building furniture|| plans for furniture|| plans for outdoor furniture|| plans for pvc furniture|| plans for wood furniture|| plans for woodwork|| plans to build furniture|| plans to build outdoor furniture|| playhouse furniture plans|| plywood furniture plans|| pvc furniture plans|| recording studio furniture plans|| redwood furniture plans|| rustic furniture plans|| rustic wood furniture plans|| shaker furniture plans|| shaker style furniture plans|| sideboard furniture plans|| simple furniture plans|| simple wood furniture plans|| simple woodwork plans|| small furniture plans|| southwest furniture plans|| stickley furniture plans|| storage furniture plans|| studio furniture plans|| table furniture plans|| tv furniture plans|| wood furniture plans|| wood outdoor furniture plans|| wood working furniture plans|| wooden furniture plans|| wooden outdoor furniture plans|| woodwork bench plans|| woodwork plans|| woodwork shop plans|| woodworking plans baby furniture|| woodworking plans for furniture|| woodworking plans for outdoor furniture|| working furniture plans|| wright furniture plans|| x 4 furniture plans|| yard furniture plans|| yourself furniture plans||woodworking,00000000,"Easy To Do Building Your Own Pergola This is a structure that will still get you wet in rain, exposed to wind and direct sunlight. Nowadays, the Westport plank chair has evolved into Adirondack chair."
http://www.bollenbachroofingco.com,Bollenbach Roofing Co.,Check out this GoDaddy hosted webpage! http://bollenbachroofingco.com.,,00000000,"Bollenbach Roofing Co. Bollenbach Roofing Co. Quality Doesnt Cost, It Pays. When you call Bollenbach you get Bollenbach for all your roofing needs."
http://www.decksbygent.com,Gent construction - Home,CUSTOM DECKS AT FAIR PRICES||porch roofs||pool decks,decks||deckbuilder||composite decking||deck contractor||best deck builder||wood deck builder,00000000,"According to a recent report, a typical American homeowner who adds a deck to their home could recoup 75150 percent of the total cost if the house is sold within a year of the decks construction. We have seen some great value increases on high end custom decks, easily in the 120150 percent range."
http://www.dulans-sfk.com/,About - Inglewood|| CA - Dulan's Soul Food Kitchen,Call Dulan's Soul Food Kitchen at (310) 671-3345 for all of your southern style food needs. We are located in Inglewood|| CA.,Fried chicken|| baked chicken|| southern style|| dinner|| baked fish|| meatloaf|| ox tails|| dessert|| Inglewood|| CA|| Dulan's Soul Food Kitchen,323-418-8527,"About  Inglewood, CA  Dulans Soul Food Kitchen. Dulans is the best soul food this side of the Mississippi hands down...The food is amazing, everything cooked well, seasoned through and through, portions are generous, the selection is great."
http://www.fuzzy-lint.myshopify.com,Create an Ecommerce Website and Sell Online! Ecommerce Software by Shopify,Shopify provides a reliable Ecommerce platform so you focus on selling online! Integrated hosting|| shopping cart and Ecommerce payment solution all in one!,,00000000,"Create an Ecommerce Website and Sell Online Ecommerce Software by Shopify. click Connect existing domain, and enter."
http://www.geminiplasticsinc.com/,Plastic Manufacturer | Gemini Plastics|| Inc. | De Pere|| WI,Gemini Plastics|| Inc. is an industrial plastic component manufacturer supplying the OEM marketplace. What can Gemini Plastics|| Inc. do for you?,,00000000,"Plastic Manufacturer  Gemini Plastics, Inc.  De Pere, WI. Founded in 1974, Gemini Plastics, Inc. began with a customer focus that remains the market leader."
http://www.kayacommunications.net/,Kaya Communications,,cle elum computer repair||cle elum computer||ellensburg computer repair||ellensburg computer||computer repair||computer consultant||cle elum computer consultant||network||central washington computer repair||yakima computer repair||yakima computer||kittitas county computer||technology||cle elum technology||cle elum security camera,00000000,Hawaii Islands premier source of Technology and Computer Specialists. Our team members are Microsoft Certified Systems Engineers MCSE with a strong commitment to quality and a wealth of experience to bring you the very best in technology and security solutions.
http://www.kingsbuffet.com,kingsbuffet.com,Forsale Lander,,00000000,"One of our domain experts will have a price to you within 24 business hours. By submitting and clicking Get Price, you agree to our."
http://www.mybob.net,Accutron Repair,,,00000000,"Only Recommended Accutron Repair Site, Accutron Spaceview Repair, Accutron Service, Accutrons for Sale, Accutron Astronaut, Vintage Accutrons. Accutron Repair, Recommended, Spaceview Repair, Accutron Astronaut Repair, Accutron Ser."
http://www.northseattlepainters.com,North Seattle Painters | Residential Exteriors,Offering long lasting Exterior Painting and related repairs for the North Seattle area,u district|| greenwood|| queen anne|| bothell|| edmonds|| lynnwood|| everett,00000000,"North Seattle Painters  Residential Exteriors. Northgate, Greenwood and areas of the Eastside  We paint any size Structure from single family houses up to Mid Rise buildings, generally to six stories."
http://www.onceuponastorybookstudio.com/,Once Upon a StoryBook Studio,,,00000000,The days of being invited into the fairytale stories of our children is dwindling. Join our Magical Scroll Newsletter and be first in all the land to know about our special events and fairytale portrait adventures.
http://www.orlandparkcounselors.com,Orland Park CounselorsOrland Park Counselors,"Orland Park Counselors providing counseling services to couples adults 
teens and kids Orland Park Illinois counselors counsel kids couples marital 
marriage counseling Pet Grief art therapy and depression anxiety OCD 
bipolar disorder encourage wellness relaxation well being psychotherapy 
relaxation massage therapy",,00000000,"Some people seek counseling because they have experienced a stressful or traumatic life event, and speaking with a counselor helps them process the situation. These new experiences can often bring difficult decisions with them, and counselors can give unbiased input to help people make the best choices."
http://www.plumbingtheriteway.com,,,,00000000,For full functionality of this site it is necessary to enable JavaScript. instructions how to enable JavaScript in your web browser
http://www.renowncargotrailers.com,Enclosed Cargo Trailers | Cargo Trailers | Top Enclosed Trailers Company,,,(888) 287-3954,Enclosed Cargo Trailers  Cargo Trailers  Top Enclosed Trailers Company. Update Some trailers may have longer build times because of a shortage of aluminum in our industry.
http://www.shapingconcepts.com,Personal Trainer Charleston|| SC | Shaping Concepts,Professional top-rated personal trainers! Discover why over 3||000 Charleston|| SC area residents have chosen Shaping Concepts for private personal training since 2004.,,Phone : 843-971-8665,With our unique TEAM TRAINING system we can also simply provide MORE availability for scheduling workouts than our competitors due to having both a primary and secondary coach which ultimately helps our clients stay more consistent with making it to the gym and therefore seeing better results. The personal trainers here are wonderful and they do a good job of targeting the areas you want to work on.The exercise routines and Shanes diet strategies provide a great combination of working hard and eating right that can change your life forever.
http://www.texasstrengthsystems.com/,Texas Strength Systems,Texas Strength Systems,,00000000,Starting Strength Power Rack original depth. We manufacture and distribute strength and conditioning equipment for home and commercial gyms across the nation.
http://www.tlcwildlifemanagement.com,Humane Wildlife Removal | TLC Wildlife Management | Columbus,TLC Wildlife Management serves residential|| commercial|| and municipal clients in humane wildlife management in the Columbus and surrounding areas. With over 25 years of experience|| we are quick to problem-solve based on animalsâ behavior|| biology and seasonality. We offer efficient|| cost-effective solutions to keep wildlife wild and your property protected.,,00000000,"Humane Wildlife Removal  TLC Wildlife Management  Columbus. For over 20 years, Adam has been studying the behavior and biology of our local wildlife and creating specialized methods for intervening when wildlife and humans mix."
http://zjunited.com/,Iron oxide pigment|| Iron oxide red (yellow||black||orange||brown)|| Compound ferric green - Toda United Industrial,Toda United Industrial (Zhejiang) Co.|| Ltd. is a leading iron oxide pigment manufacturer in China||Our iron oxide pigments range:Iron oxide red ||Iron oxide yellow||Iron Oxide black||Iron oxide orange||Iron oxide brown||Compound ferric green etc.,Iron oxide pigment ||Iron oxide ||Iron oxide red ||Iron oxide yellow||Iron Oxide black||Iron oxide orange||Iron oxide brown||Compound ferric green,00000000,"Iron oxide pigment, Iron oxide red yellow,black,orange,brown, Compound ferric green  Toda United Industrial. A new iron oxide with a complex monoclinic structure."
https://3fb82a0eyhjcsc29mjga4q1m3r.hop.clickbank.net/,Unauthorized Affiliate - error page,,,00000000,This site is no longer in service or has been disabled due to a terms of service violation. Copyright  Click Sales Inc.  1444 S. Entertainment Ave  Suite 410  Boise ID 83709
https://DenversHomeTeam.com,Denver Metro Real Estate - Homes for Sale in Denver Metro,Search homes for sale in Denver Metro. Listings include large photos|| virtual tours|| Google Maps & Street View|| local school info and more.,,00000000,"Denver Metro Real Estate  Homes for Sale in Denver Metro. Create your custom home search, or start with one of the following."
https://LiquidComputerz.com,LiquidComputerz – Your Local Tech Support Company,Why Go Liquid? Our mission is to alleviate the stress|| headache|| grief|| and aggravation that comes along with any internet connected device. Let us be your first call for any I.T. problem. Services Offered â¢ Computer Diagnostics|| Repair|| Refurbishing & Building â¢ Tutoring || Classes & Training â¢ Printer Setup and Troubleshooting â¢ Network Troubleshooting…,,00000000,"LiquidComputerz  Your Local Tech Support Company. Our mission is to alleviate the stress, headache, grief, and aggravation that comes along with any internet connected device. ."
https://Soteriahomecareco.com,In-Home Care Specialists – Professional Services Website,,,00000000,InHome Care Specialists  Professional Services Website. Our Client Care Specialists work closely with you to identify and understand your goals and transform them into an actionable plan of care.
