url,title,description,keywords,contact_info,summary
https://WICKEDPIECES.COM,wickedpieces,wickedpieces,,00000000,Choosing a selection results in a full page refresh
https://Www.craftmarkID.com,Craftmark Pipe Makers – Craftmark Pipe Markers,Since its inception in 1959|| Craftmark has developed into a global leader in pipe marker products. From development to testing and in-house manufacturing|| Craftmark assured its products meet or exceed industry standards and our customer expectations.,,00000000,Craftmark Pipe Makers  Craftmark Pipe Markers. Around the globe there are various Pipe Marking specifications that are all focused on the same end result Safety.
https://accurateautomotivecarellc.com,Auto Repair Shop & Auto Service Wisconsin Rapids|| WI - Accurate Automotive Care LLC,Accurate Automotive Care LLC offers auto repair shop services to Wisconsin Rapids|| WI that you can count on! From brakes & tires|| to engines & transmissions make sure you call us at (715) 421-2270!,,00000000,"Auto Repair Shop  Auto Service Wisconsin Rapids, WI  Accurate Automotive Care LLC. Its great having a mechanic you can trust, and I always trust Accurate with my auto repairs."
https://acsoncall.com,Abundant Computer Services - Computer Repair Jacksonville FL,We have been serving the Jacksonville area since 2006 with 1000's of happy clients. Call or Text 904-274-0155 for service today. Quick turn around services!,computer repair jacksonville florida||computer repair near me||pc repair jacksonville florida||pc repair near me||computer technician,00000000,Abundant Computer Services  Computer Repair Jacksonville FL. We have been serving clients like you in the Jacksonville area since 2006.
https://airtest1.com,AIR - Air quality testing|| laboratory|| and services.,Source emission testing|| laboratory services|| and permitting assistance. Stack testing focused on our clients.,,00000000,"AIR  Air quality testing, laboratory, and services. From former directors of state regulatory agencies to Fortune 50 environmental department leaders, AIR has the experience and knowledge to assist in any air compliance needs."
https://aleesasoaps.com/collections/natural-soap,"Natural Soap
 – Aleesa Bath and Body",Quality|| homemade soaps|| lotions and beauty products. Our products use the highest quality oils and fragrances. We also have a huge selection of gift items. From candles and handbags|| to jewelry and kids gift items,,00000000,"Taxes and shipping calculated at checkout. Share contact information, store details, and brand content with your customers."
https://allprotreeandcranenc.com/,All Pro Tree and Crane|| Inc. | Excellence in Tree Service,We are Western North Carolina's choice in professional tree service. All Pro is here for it all|| from complex tree removals to annual tree trimming needs.,,00000000,"All Pro Tree and Crane, Inc.  Excellence in Tree Service. was very helpful to my daughters, in retrieving a very scared cat out of the tree."
https://amplesell.shop,Buy Best Sellers online,Great selection of Best Sellers at affordable prices! Fast US shipping. 100% money back guarantee. Friendly customer service.,Gadgets|| Electronics|| Home Products|| Kitchen Products|| Kids Products|| Baby Products|| Pets Supplies|| Toys|| Games Accessories,00000000,Multifunctional Car Seat Organizer Set Left  Right. You Are My Sunshine Sunflower Pendant Necklace.
https://atpsports.co,TrubliFit - Everything you need for your Peloton Bike,Upgrade your Peloton bike with custom accessories from TrubliFit. Find your true ability with everything you need to improve your Peloton Bike|| Peloton Bike+ or Tread. Designed by Peloton Addicts for Peloton Addicts.,,00000000,A mechanical engineering couple on a mission to give you the best Peloton ride possible. We pride ourselves on the quality of all of our products and want to make sure you are 100 happy with your purchase.
https://batteriesbymbs.com,Fast Car Battery Replacement | Mobile Battery Solutions,mobile battery solutions We come to you with mobile car battery delivery and installation|| wherever you are! We can replace your car battery on site with same day service – in as little as one hour!Â  3 Year Nationwide Warranty Get A Quote Now Proud Partners of: We come to you with same day service … Home Read More Â»,,00000000,"Fast Car Battery Replacement  Mobile Battery Solutions. ÂPlease check back, we are continually adding new coverage areas."
https://beatphysicaltherapy.com,Physical Therapy Services in Columbia MD | BEAT Physical Therapy,Beat Physical Therapy is here to help you overcome past or recent injury. Contact us today at (410) 884-0003 for physical therapy in Columbia|| MD.,,00000000,Physical Therapy Services in Columbia MD  BEAT Physical Therapy. I have had about a dozen therapists and she is one of my favorites.
https://bio-fit.purewellness.info/,GetResponse - Landing Page Creator,,,00000000,Want to create landing pages that will bring more people to your business. Bring your idea to life with a. landing page builder.
https://blackmagichunter.com,Black magic Removal - HEALER NKUBA,Spiritual Healer Nkuba is renowned|| world Top expert in providing accurate astrological solutions and Black magic Removal for your life problems offers best astrology reading services in the field of Horoscope|| Future Predictions|| Astrological Solutions for Love Marriage and Relationship Problems|| Vashikaran|| Negative Energies and Black Magic Removal|| Kala Jadu to get rid of your personnel|| Financial|| Business and other problems in your life.,,00000000,Best Quality healing Services and black magic removal. Get spiritual energy to create a powerful energy shield to protect you from curses and hexes.
https://blueringtechnologies.com,Blue Ring Technologies – Product Design | Injection Molding | Prototype,,,Phone: 305-707-4251,Blue Ring Technologies  Product Design  Injection Molding  Prototype. What really do you get with Engineering and Prototype Drawing Services.
https://bodze.com,BÅdze - Plastic Surgery â¢ Wellness Center â¢ Medical Spa,,,00000000,"Here at bÅdze we have an award winning staff thats committed to providing exceptional results and the highest quality patient care, guaranteed. Weve paired the best providers in the business with industry leading technology to deliver the highest quality patient experience."
https://breecustomz.com/,BreeCustomz,Graphic T-Shirts || Hoodies|| Sweatshirts. Black Owned Business.,,00000000,"BreeCustomsz is a black owned customizable graphic tee shirt business. Share contact information, store details, and brand content with your customers."
https://broomsticker.co.uk/WallStickers,Wall Stickers | Wall Stickers Store  - UK shop with wall stickers|| wall decals,,,00000000,"Wall Stickers  Wall Stickers Store   UK shop with wall stickers, wall decals. All Rights Reserved Copyright Â Broomsticker.co.uk 20112020"
https://californiabirthcertificate.org/,California (CA) Birth Certificate | Order Online,Order official California Birth Certificates online fast and securely through CaliforniaBirthCertificate.org. Submit your online application to get started with your order.,,00000000,"California CA Birth Certificate  Order Online. Ordering a certified copy of a vital record has never been this quick and easy Instead of traveling to your local county recorder or filing through different forms, CaliforniaBirthCertificate.org makes it possible to order a certified copy of your birth certificate online from the comfort of your home or office within minutes."
https://californiacleanchemistry.com,Online shopping for Electronics & UV Products with free shipping,Great selection of Electronics & UV Products at affordable prices! Free shipping. 45 days money back guarantee. Friendly customer service.,Electronics|| Headphones|| Earphones|| Speakers|| Smart Watches|| Smart Watches Accessories|| Cables|| Adapters|| Chargers|| Home Electronics|| Wireless Gadgets|| Fitness Gadgets|| Sports Gadgets|| GoPro Style Cameras|| Smartphone Accessories|| Cases|| Covers|| Screen Protectors|| UV Disinfection Products|| Air Purifiers|| UV Wands|| UV Sterilization Bags|| UV Ozon Filters|| UV Sterilizers,00000000,"You will not regret the decision to buy from this online shop thanks to a rich selection of goods, affordable prices and outstanding customer service. Furthermore, dont forget to come back often to see our new offers and promotions The team is full of ideas and likes surprises."
https://chad-barker.pixels.com/,Chad Barker - Official Website,This is the website of Chad Barker.  Shop for canvas prints|| framed prints|| posters|| greeting cards|| and more.  Coming soon...,,00000000,Use code ABCXYZ at checkout for a special discount. Kirby Smart and Kelee Ringo by Chad Barker.
https://cliqkio.com/app/flat-belly-fix/,Cliqkio,app|| web app|| responsive|| admin dashboard|| admin|| flat|| flat ui|| ui kit|| off screen nav,,00000000,
https://commercialprinting.store,Sandys Business Center,Welcome to Sandy's Business Center Where Great Ideas Happen Our commercial printing shop provides comprehensive printing and copying services to help you streamline project management|| expedite production|| and facilitate a quality end product. From help designing your products to shipping services for them|| we do it all. We are your local business center,,00000000,"Our commercial printing shop provides comprehensive printing and copying services to help you streamline project management, expedite production, and facilitate a quality end product. From help designing your products to shipping services for them, we do it all."
https://computerrepairjacksonvilleflorida.com/,"Computer Repair Jacksonville Florida - We Make ""IT"" Simple",Abundant Computer Services|| LLC - We specialize in Computer Repair|| Networking|| Virus Removal and more! Call 904.371.3118 for Service Today.,computer repair jacksonville||computer repair jacksonville fl||computer repair jacksonville florida||computer repair near me||computer repair 32223||computer repair||computer repair 32257||computer virus removal jacksonville florida||computer virus removal||computer repair technician,00000000,Computer Repair Jacksonville Florida  We Make IT Simple. Is your computer acting up like a kid in a candy store Are you tired ofÂdealing with big box stores We are local and conveniently located.
https://computerrepairtampabay.com,#1 Tampa Bay Fast Computer Repair – Computer Doctors,Fast on-site computer repair services. Serving Tampa Bay 24/7 Desktop and Laptop Repair.,,00000000,"1 Tampa Bay Fast Computer Repair  Computer Doctors. Have been using them for about 2 years and will continue to do so again and again and again........ I hesitated recommending them because I was thinking that if everybody hired them, they would put me on the sidelines."
https://consistent-clothing.biz.site,Consistent Clothing,Clothing (Brand)|| Personal blog|| Beauty|| Cosmetic & Personal Care,Clothing (Brand)||Personal blog||Beauty|| Cosmetic & Personal Care,00000000,You need to enable JavaScript to run this app
https://contouree.com/,Contouree - Create Your Beautiful Custom Photo Cutouts,Contouree is on a mission to put smiles on faces. Our personalized products capture precious moments of everyday life. We connect your family and friends with joy. Whether itâs a gift or an addition to your home|| we help you to treasure those moments of your life. One smile at a time.,,00000000,Contouree  Create Your Beautiful Custom Photo Cutouts. Our unique way to remove the background of any images makes the story more vivid to tell.
https://cpandp.com/,Label Printer | Chemical Labels | Packaging and Printing,As a family-owned business with deep roots in the Upstate|| we have partnered with a number of businesses in a variety of industries - newspaper|| food & beverage|| chemical|| and industrial - to meet their unique packaging and print needs.,,00000000,"Unless you have a lot of unused space in your current facility which is rarely the case, you may have difficulty storing all of the labels you need going forward during production. If you have a current printing and packaging vendor, it most likely gives you a number of hoops for your people to jump through before it will accept the files for your labels."
https://dataray.com/,Laser Beam Profilers | DataRay Inc.,DataRay,,00000000,"Laser Beam Profilers  DataRay Inc. Beam Profiling Cameras. DataRay Inc. was founded in 1988 to bring highquality, affordable, and reliable instrumentation to the photonics industry."
https://dealsrhere.com/product-category/toys/,Toys Archives - Deals R Here,,,Phone: 1-(800)550-2196,Brand new 164 scale diecast car models of Auto Trucks 6 piece Set Release 64 IN DISPLAY CASES Limited Edition to 7250 pieces Worldwide die cast model cars by M2 Machines. Brand new 164 scale diecast car models of Auto Trucks 6 piece Set Release 66 IN DISPLAY CASES Limited Edition to 7250 pieces Worldwide die cast model cars by M2 Machines.
https://delectamentieats.com,Delectamenti Eats,,,00000000,Want fresh cut Microgreens grown locally. For contactless delivery we can place the order in your cooler.
https://diabetes-home.naturalway.site,Unauthorized Affiliate - error page,,,00000000,This site is no longer in service or has been disabled due to a terms of service violation. Copyright  Click Sales Inc.  1444 S. Entertainment Ave  Suite 410  Boise ID 83709
https://drmikepierquet.com,The Mini Implant Center Of Germantown|| WI - Mini Dental Implant Center,Dr Mike Pierquet's Mini Implant Center in Germantown|| WI provides easy|| affordable tooth replacement with mini dental implants.,,00000000,"The Mini Implant Center Of Germantown, WI  Mini Dental Implant Center. Â. The same way the old style conventional implants changed the game, mini dental implants are changing it again  but to a much greater degree."
https://expertcompression.com/shop/,500 Internal Server Error,,,00000000,"The server encountered an internal error ormisconfiguration and was unable to completeyour request. Please contact the server administrator at  webmasterexpertcompression.phoerafoundationcosmetics.com to inform them of the time this error occurred, and the actions you performed just before this error."
https://fashionfurniture.com,Fashion Furniture Rental: Rent Furniture That's Modern|| Affordable|| Fast,We provide a sense of home. Easily rent furniture|| home goods|| and decor online and we'll handle the rest. Superior service guaranteed!,,00000000,"Fashion Furniture Rental Rent Furniture Thats Modern, Affordable, Fast. If you need your items for less than 3 months, we can pick them up sooner, however, we will still need to process payment for at least 3 months."
https://franciscoramospart.wixsite.com/florblanca,Home | Florblanca,,,00000000,"Use tab to navigate through the menu items. Viernes,Domingos,Martes 5pm a 6pm 2x1 Miercoles i Jueves CUBETA A SOLO 20dls."
https://frannys-farmacy-augusta.business.site,Frannys Farmacy Augusta CBD - Cannabis Store in Evans,,,00000000,"Frannys Farmacy Augusta CBD  Cannabis Store in Evans. Expanding from one Asheville, NC location to nearly a dozen dispensaries across North Carolina, Georgia, South Carolina, and Connecticut â with many more on the way for 2022 to include AugustaEvans GA."
https://frishay.com,FRISHAY Â® Where You Can Buy Securely ! -,With best online shopping experience|| Frishay is designed for our Worldwide customers needs. Get the latest products with great discounts.,,Phone Makeup Youtube Tiktok,May you also like Golf men professional sports shoes. Women Golf clubs set HONMA Golf Club HONMA BEZEAL 525 Golf Complete Set with wood putter Head Cover No Bag Free Shipping.
https://gent-construction.biz.site/,Gent Construction,Over twenty years experience|| fully insured. Check out some of our pictures! We can create your dream deck or porch! ,Construction Company||Contractor,00000000,You need to enable JavaScript to run this app
https://get-some-outdoors-again.biz.site,Get Some Outdoors Again,A place to get geared up for your outdoor activates made easy|| just one click and your on your way!,Outdoor Activity Organizer||Childrens Outdoor Activities||Outdoor Clothing Equipment Shop,00000000,You need to enable JavaScript to run this app
https://getglucotrust.com/?hop=jrhodes8,Home,,,00000000,"And on top of all of that, each capsule contains a blend of 15 herbs that regulate your bodys natural hormonal balance and allow this whole biochemical process to run smoothly. Because when you order any amount of GlucoTrust todayone bottle, three bottles or sixyoure covered by a 100 money back guarantee good for 180 days."
https://go-belly-fat.doctornewage.club,Unauthorized Affiliate - error page,,,00000000,This site is no longer in service or has been disabled due to a terms of service violation. Copyright  Click Sales Inc.  1444 S. Entertainment Ave  Suite 410  Boise ID 83709
https://gspresson.com,Good Samaritan Press On Apparel graphic t-shirts|| expression tees for all events,"Good Samaritan Press on Apparel provide graphic t-shirts|| expression tees and apparel for events and everyday wear. We can do simple custom designs on apparel and accessories such as totes. In addition|| we strive to bring awareness to the work and volunteer needs of charitable organizations. 


",,00000000,"Good Samaritan Press On Apparel graphic tshirts, expression tees for all events. Use tab to navigate through the menu items."
https://haircareandbeauty.com/,Hair Care & Beauty,We are a family owned business|| specializing in Hair Care|| Health and Beauty merchandise at incredibly low prices. Hard to find and discontinued items are our specialty. we sell top Brands as Tigi|| KMS|| L'Oreal|| Sexy Hair|| Joico|| Redken|| Sebastian|| Kenra|| Nioxin|| Matrix|| Deva|| Goldwell|| Paul Mitch and more,,00000000,"We are an online retailer of high end and salon grade hair and beauty products. We specialize in discontinued items, reuniting loyal customers with the products they love."
https://hakuna-supply.biz.site/,Hakuna Supply,Hakuna Supply is a lifestyle brand offering lifestyle storage|| trays|| and accessories. Our goal is to keep your herbs fresh and your area clean and secure.,Product/service||Retail Company||Accessories,00000000,You need to enable JavaScript to run this app
https://hathawayholland.com,Bankruptcy Criminal Defense Lawyer | Hathaway Holland Law Firm | Bellingham,,,00000000,"Bankruptcy Criminal Defense Lawyer  Hathaway Holland Law Firm  Bellingham. Thanks to Steven, I was able to save my home from foreclosure."
https://healthy-paw-life.myshopify.com/,American Express,Healthy Paw Life is a fun-loving custom pet goods brand. Our ultimate goal is to bring you products that make your pet's life simpler|| easier|| more efficient|| and happier. We offer quality products at best price deals.,,00000000,"We believe the relationship with our pets is one of the most important bonds we have in life, and that a better understanding of our petsâ health is critical to strengthening that connection. Unsure of whatâs causing your petâs skin problem Our antifungal and antibacterial medicated shampoo with lime sulfur has been proven effective for nonspecific dermatoses."
https://heritage-law.com,Please Wait... | Cloudflare,,,00000000,"Please stand by, while we are checking your browser. Completing the CAPTCHA proves you are a human and gives you temporary access to the web property."
https://http-www-soselfish-com.biz.site,Doubles wss,Stock Broker|| Biotechnology Company|| Beauty Products Wholesaler|| Lottery Retailer,Stock Broker||Biotechnology Company||Beauty Products Wholesaler||Lottery Retailer,00000000,You need to enable JavaScript to run this app
https://ibexeng.net,404 Not Found,,,00000000,"The requested URL  was not found on this server. Additionally, a 404 Not Founderror was encountered while trying to use an ErrorDocument to handle the request"
https://ignitethecourt.com,Tennis Lessons | Ignite Tennis Academy | Burlingame | San Mateo |,Our vision is toÂ ignite a love for tennis and provide the best opportunity for students to excel. We our classes fun and dynamic while focused on learning specific techniques|| and have the lowest student/coach ratio in the area!,Be|| The|| Best|| In|| Game,00000000,Tennis Lessons  Ignite Tennis Academy  Burlingame  San Mateo . He started Ignite Tennis Academy in 2019 with the goal of providing the community with exceptional tennis programs that emphasize character development.
